ano,grupo_desp_nome,subelemento_nome, valor_liquidado 
2015,PESSOAL E ENCARGOS SOCIAIS,OUTRAS INDENIZAÇÕES TRABALHISTAS - RGPS, 16.478.12 
2015,PESSOAL E ENCARGOS SOCIAIS,OUTRAS OBRIGAÇÕES PATRONAIS, 1.172.328.31 
2015,PESSOAL E ENCARGOS SOCIAIS,OUTRAS SENTENÇAS JUDICIAIS TRANSITADAS E JULGADAS - RGPS, 838.987.85 
2015,PESSOAL E ENCARGOS SOCIAIS,OUTRAS SENTENÇAS JUDICIAIS TRASITADAS E JULGADAS - RPPS, 5.206.110.85 
2015,PESSOAL E ENCARGOS SOCIAIS,PARA REMANEJAMENTO S/OBJETO NO SISTEMA SPCS-CONSISTENCIA, -   
2015,PESSOAL E ENCARGOS SOCIAIS,PENSÕES CIVIS, 60.291.340.03 
2015,PESSOAL E ENCARGOS SOCIAIS,PENSÕES ESPECIAIS, 1.888.551.63 
2015,PESSOAL E ENCARGOS SOCIAIS,PENSIONISTAS - RPPS, 334.658.30 
2015,PESSOAL E ENCARGOS SOCIAIS,PRECATÓRIOS - ATIVO CIVIL, 5.495.535.32 
2015,PESSOAL E ENCARGOS SOCIAIS,PRECATÓRIOS - ATIVO CIVIL - RGPS, 769.815.75 
2015,PESSOAL E ENCARGOS SOCIAIS,RECIFIN, 49.211.627.49 
2015,PESSOAL E ENCARGOS SOCIAIS,RECIPREV, 69.193.193.19 
2015,PESSOAL E ENCARGOS SOCIAIS,RESSARCIMENTO DE DESPESAS DE PESSOAL REQUISITADO, 1.878.331.90 
2015,PESSOAL E ENCARGOS SOCIAIS,RESSARCIMENTO DE DESPESAS DE PESSOAL REQUISITADO DA UNIÃO, 1.131.044.02 
2015,PESSOAL E ENCARGOS SOCIAIS,RESSARCIMENTO DE DESPESAS DE PESSOAL REQUISITADO DE ESTATAIS NÃO DEPENDENTES, 589.524.99 
2015,PESSOAL E ENCARGOS SOCIAIS,RESSARCIMENTO DE DESPESAS DE PESSOAL REQUISITADO DE OUTROS ESTADOS, 323.506.10 
2015,PESSOAL E ENCARGOS SOCIAIS,RESSARCIMENTO DE DESPESAS DE PESSOAL REQUISITADO DE OUTROS MUNICÍPIOS, 97.038.75 
2015,PESSOAL E ENCARGOS SOCIAIS,RESSARCIMENTO DE DESPESAS DE PESSOAL REQUISITADO DO ESTADO DE PERNAMBUCO, 2.043.993.64 
2015,PESSOAL E ENCARGOS SOCIAIS,RESSARCIMENTO DE PESSOAL REQUISITADO DO ESTADO-RGPS, 546.376.50 
2015,PESSOAL E ENCARGOS SOCIAIS,SALÁRIO-FAMÍLIA - INATIVO PESSOAL CIVIL, 2.737.26 
2015,PESSOAL E ENCARGOS SOCIAIS,SALÁRIO-FAMÍLIA - PENSIONISTA PESSOAL CIVIL, 84.32 
2015,PESSOAL E ENCARGOS SOCIAIS,SENTENÇAS JUDICIAIS TRANSITADAS E JULGADAS - ATIVO CIVIL-RGPS, 6.964.904.95 
2015,PESSOAL E ENCARGOS SOCIAIS,SENTENÇAS JUDICIAIS TRANSITADAS E JULGADAS, CARGO ÚNICO - ATIVO CIVIL, 5.056.749.14 
2015,PESSOAL E ENCARGOS SOCIAIS,SERVIÇOS EXTRAORDINÁRIOS, 49.329.552.96 
2015,PESSOAL E ENCARGOS SOCIAIS,SERVIÇOS EXTRAORDINÁRIOS - RGPS, 168.416.51 
2015,PESSOAL E ENCARGOS SOCIAIS,SUBSÍDIOS, 166.800.00 
2015,PESSOAL E ENCARGOS SOCIAIS,SUBSTITUIÇÕES, 28.643.164.54 
2015,PESSOAL E ENCARGOS SOCIAIS,VALE - REFEIÇÃO PARA SERVIDORES (FOLHA PAGTO), 24.894.095.84 
2015,PESSOAL E ENCARGOS SOCIAIS,VENCIMENTOS E SALÁRIOS, 982.080.841.68 
2015,PESSOAL E ENCARGOS SOCIAIS,VENCIMENTOS E SALÁRIOS - RGPS, 4.987.156.40 
2015,PESSOAL E ENCARGOS SOCIAIS,VENCIMENTOS E VANTAGENS - RGPS, 65.545.80 
2016,AMORTIZACAO DA DIVIDA,AMORTIZAÇÃO DA DÍVIDA CONTRATADA COM GOVERNOS, 12.166.293.49 
2016,AMORTIZACAO DA DIVIDA,AMORTIZAÇÃO DA DÍVIDA CONTRATUAL C/INSTITUIÇÕES FINANCEIRAS, 42.926.371.85 
2016,AMORTIZACAO DA DIVIDA,AMORTIZAÇÃO DA DÍVIDA PREVIDENCIÁRIA, 8.427.260.61 
2016,AMORTIZACAO DA DIVIDA,PARCELAMENTO DE FGTS, 56.205.36 
2016,INVESTIMENTOS,APARELHOS DE MEDIÇÃO E ORIENTAÇÃO, 7.083.97 
2016,INVESTIMENTOS,APARELHOS E EQUIPAMENTOS DE COMUNICAÇÃO, 184.331.88 
2016,INVESTIMENTOS,APARELHOS E EQUIPAMENTOS PARA ESPORTES E DIVERSÕES, 903.977.20 
2016,INVESTIMENTOS,APARELHOS E UTENSÍLIOS DOMÉSTICOS, 765.751.17 
2016,INVESTIMENTOS,APARELHOS, EQUIPAMENTOS, UTENSÍLIOS MÉDICOS, ODONTOLÓGICOS, LABORATORIAIS E HOSPITALARES, 6.350.204.23 
2016,INVESTIMENTOS,AQUISIÇÃO DE SOFTWARES, 209.790.00 
2016,INVESTIMENTOS,AUDITORIA EXTERNA, 23.505.30 
2016,INVESTIMENTOS,BENFEITORIAS EM PROPRIEDADES DE TERCEIROS, 450.723.37 
2016,INVESTIMENTOS,BENS PARA INCORPORAÇÃO AO PATRIMÔNIO, -   
2016,INVESTIMENTOS,CASAS, 13.562.509.96 
2016,INVESTIMENTOS,COLEÇÕES E MATERIAIS BIBLIOGRÁFICOS, 2.601.237.76 
2016,INVESTIMENTOS,DEPOSITOS COMPULSORIOS, 8.484.00 
2016,INVESTIMENTOS,DISCOTECAS E FILMOTECAS, 1.385.00 
2016,INVESTIMENTOS,EQUIPAMENTOS DE PROCESSAMENTO DE DADOS, 3.812.491.71 
2016,INVESTIMENTOS,EQUIPAMENTOS DE PROTEÇÃO, SEGURANÇA E SOCORRO, 66.220.00 
2016,INVESTIMENTOS,EQUIPAMENTOS E MATERIAL PERMANENTE, 5.146.490.78 
2016,INVESTIMENTOS,EQUIPAMENTOS E UTENSÍLIOS HIDRÁULICOS E ELÉTRICOS, 621.931.42 
2016,INVESTIMENTOS,EQUIPAMENTOS PARA ÁUDIO, VÍDEO E FOTO, 189.913.95 
2016,INVESTIMENTOS,EQUIPAMENTOS PARA SINALIZAÇÃO DO TRÂNSITO E TRANSPORTE URBANO, 15.000.00 
2016,INVESTIMENTOS,EQUIPAMENTOS, UTENSÍLIOS E INSTALAÇÕES DIVERSAS, -   
2016,INVESTIMENTOS,ESTUDOS E PROJETOS, 11.917.722.52 
2016,INVESTIMENTOS,FERRAMENTAS, 15.965.96 
2016,INVESTIMENTOS,HONORÁRIOS S/PROC  DE IND  DE TERRENOS/IMÓVEIS/BENFEITORIAS, 6.859.98 
2016,INVESTIMENTOS,HONORÁRIOS S/PROC  DE INDEN  TERRENOS/IMÓVEIS/BENFEITORIAS, 1.760.00 
2016,INVESTIMENTOS,INDENIZAÇÕES DE BENFEITORIAS, 690.229.49 
2016,INVESTIMENTOS,INDENIZAÇÕES DE IMÓVEIS, 893.089.86 
2016,INVESTIMENTOS,INDENIZAÇÕES E RESTITUIÇÕES, 1.631.028.63 
2016,INVESTIMENTOS,INDENIZAÇÕES E RESTITUIÇÕES À UNIÃO, 1.536.155.05 
2016,INVESTIMENTOS,INSTALAÇÕES DE OBRAS, 5.574.157.38 
2016,INVESTIMENTOS,INSTALAÇÃO DE AR CONDICIONADO CENTRAL, -   
2016,INVESTIMENTOS,INSTRUMENTOS MUSICAIS E ARTÍSTICOS, 482.599.99 
2016,INVESTIMENTOS,LIMINARES EM MANDADOS DE SEGURANÇA, 11.375.32 
2016,INVESTIMENTOS,MÁQUINAS E EQUIPAMENTOS AGRICOLAS E RODOVIÁRIOS, 38.557.81 
2016,INVESTIMENTOS,MÁQUINAS E EQUIPAMENTOS DE NATUREZA INDUSTRIAL, 317.715.72 
2016,INVESTIMENTOS,MÁQUINAS E EQUIPAMENTOS ENERGÉTICOS, 572.00 
2016,INVESTIMENTOS,MÁQUINAS, FERRAMENTAS E UTENSÍLIOS DE OFICINA, 101.979.65 
2016,INVESTIMENTOS,MÁQUINAS, INSTALAÇÕES E UTENSÍLIOS DE ESCRITÓRIO, 7.160.00 
2016,INVESTIMENTOS,MATERIAIS DE CONSUMO, 263.431.65 
2016,INVESTIMENTOS,MATERIAL PARA AUTOMAÇÃO, ROBÓTICA, MECATRÔNICA E CONTROLE, 72.349.92 
2016,INVESTIMENTOS,MOBILIÁRIO EM GERAL, 7.700.371.72 
2016,INVESTIMENTOS,OBRAS E INSTALAÇÕES, 10.699.730.45 
2016,INVESTIMENTOS,OBRAS EM ANDAMENTO, 79.514.768.02 
2016,INVESTIMENTOS,OUTROS SERVIÇOS DE ENGENHARIA, 3.899.040.43 
2016,INVESTIMENTOS,OUTROS SERVIÇOS DE TERCEIROS - PESSOA JURÍDICA, 623.324.74 
2016,INVESTIMENTOS,RESTITUIÇÕES, 8.048.836.38 
2016,INVESTIMENTOS,SENTENÇAS JUDICIAIS TRANSITADAS E JULGADAS, 177.797.54 
2016,INVESTIMENTOS,SERVIÇOS DE CONSULTORIA, 5.761.576.45 
2016,INVESTIMENTOS,SERVIÇOS DE CONSULTORIA - PESSOA JURÍDICA, 4.574.678.67 
2016,INVESTIMENTOS,SERVIÇOS DE TERCEIROS - PESSOA FÍSICA, 155.000.00 
2016,INVESTIMENTOS,SERVIÇOS DE TERCEIROS - PESSOA JURÍDICA, 61.401.155.75 
2016,INVESTIMENTOS,SERVIÇOS TÉCNICOS PROFISSIONAIS, -   
2016,INVESTIMENTOS,TAXAS, 172.956.10 
2016,JUROS E ENCARGOS DA DIVIDA,ENCARGOS DA DÍVIDA CONTRATADA COM GOVERNOS, 2.129.93 
2016,JUROS E ENCARGOS DA DIVIDA,ENCARGOS DA DÍVIDA CONTRATADA COM INSTITUIÇÕES FINANCEIRAS, 10.054.445.53 
2016,JUROS E ENCARGOS DA DIVIDA,JUROS DA DIVIDA CONTRATADA COM INSTITUIÇÕES FINANCEIRAS, 41.926.653.67 
2016,JUROS E ENCARGOS DA DIVIDA,JUROS E ENCARGOS DO PARCELAMENTO DA DIVIDA CONTRATADA COM GOVERNOS, 3.303.424.83 
2016,OUTRAS DESPESAS CORRENTES,ÁGUA POTÁVEL, 570.879.60 
2016,OUTRAS DESPESAS CORRENTES,AJUDA DE CUSTO PARA CONSELHEIROS E AFINS, 171.360.93 
2016,OUTRAS DESPESAS CORRENTES,AJUDA DE CUSTO PARA TREINAMENTO, 444.036.84 
2016,OUTRAS DESPESAS CORRENTES,ALIMENTOS PARA ANIMAIS, 416.899.65 
2016,OUTRAS DESPESAS CORRENTES,APARELHOS DE MEDIÇÃO E ORIENTAÇÃO, 65.441.00 
2016,OUTRAS DESPESAS CORRENTES,APOIO ADMINISTRATIVO, TÉCNICO E OPERACIONAL, 138.934.112.21 
2016,OUTRAS DESPESAS CORRENTES,AQUISIÇÃO DE SOFTWARES, 272.982.79 
2016,OUTRAS DESPESAS CORRENTES,ASSESSORIA E CONSULTORIA TÉCNICA - PESSOA FÍSICA, 58.238.24 
2016,OUTRAS DESPESAS CORRENTES,ASSESSORIA E CONSULTORIA TÉCNICA - PESSOA JURÍDICA, 5.815.830.76 
2016,OUTRAS DESPESAS CORRENTES,ASSINATURAS DE PERIÓDICOS E ANUIDADES, 2.551.580.26 
2016,OUTRAS DESPESAS CORRENTES,AUDITORIA EXTERNA, 15.000.00 
2016,OUTRAS DESPESAS CORRENTES,AUXÍLIO A PESSOAS FÍSICAS, 16.812.708.00 
2016,OUTRAS DESPESAS CORRENTES,AUXÍLIO-FUNERAL, 144.018.82 
2016,OUTRAS DESPESAS CORRENTES,BANDEIRAS, FLÂMULAS E INSÍGNIAS, 18.500.00 
2016,OUTRAS DESPESAS CORRENTES,BENS MÓVEIS NÃO ATIVÁVEIS, 80.820.83 
2016,OUTRAS DESPESAS CORRENTES,BOLSA ESCOLA, 11.383.556.00 
2016,OUTRAS DESPESAS CORRENTES,CESSÃO DE USO DE TENDAS, GALPÕES, PAVILHÕES, EQUIPAMENTOS E ASSEMELHADOS, 4.639.330.39 
2016,OUTRAS DESPESAS CORRENTES,COFINS, 414.032.32 
2016,OUTRAS DESPESAS CORRENTES,COMBUSTÍVEIS E LUBRIFICANTES AUTOMOTIVOS, 1.261.20 
2016,OUTRAS DESPESAS CORRENTES,COMBUSTÍVEIS E LUBRIFICANTES PARA OUTRAS FINALIDADES, 5.117.72 
2016,OUTRAS DESPESAS CORRENTES,CONDOMÍNIOS, 1.282.247.83 
2016,OUTRAS DESPESAS CORRENTES,CONFECÇÃO DE UNIFORMES, BANDEIRAS, FLÂMULAS E MATERIAL EDUCATIVO, 122.664.95 
2016,OUTRAS DESPESAS CORRENTES,CONTRATO DE GESTÃO PARA PRESTAÇÃO DE SERVIÇOS DE ASSISTÊNCIA SOCIAL, 45.600.00 
2016,OUTRAS DESPESAS CORRENTES,CONTRIBUIÇÕES A ASSOCIAÇÕES E CONFEDERAÇÕES, 20.000.00 
2016,OUTRAS DESPESAS CORRENTES,CONTRIBUIÇÕES PARA SESC, SENAI, SENAC E AFINS, 1.166.026.78 
2016,OUTRAS DESPESAS CORRENTES,CONTRIBUIÇÕES PREVIDENCIÁRIAS - SERVIÇOS DE TERCEIROS, 869.734.82 
2016,OUTRAS DESPESAS CORRENTES,CONTRIBUIÇÃO A ASSOCIAÇÕES, SINDICATOS E AFINS, 246.091.41 
2016,OUTRAS DESPESAS CORRENTES,CONTRIBUIÇÃO PARA O PASEP, 39.150.073.29 
2016,OUTRAS DESPESAS CORRENTES,CONTRIBUIÇÃO PARA O PIS, 33.559.42 
2016,OUTRAS DESPESAS CORRENTES,CONVÊNIOS DE COOPERAÇÃO TÉCNICA, 4.228.941.83 
2016,OUTRAS DESPESAS CORRENTES,CULTURA, TURISMO, ESPORTES, FESTIVIDADES E LAZER, 609.778.78 
2016,OUTRAS DESPESAS CORRENTES,DEPÓSITOS E CAUÇÕES, 6.025.45 
2016,OUTRAS DESPESAS CORRENTES,DEPÓSITOS PARA RECURSOS, 985.82 
2016,OUTRAS DESPESAS CORRENTES,DIÁRIAS - PESSOAL CIVIL, 14.900.00 
2016,OUTRAS DESPESAS CORRENTES,DIÁRIAS A COLABORADORES EVENTUAIS, 4.200.00 
2016,OUTRAS DESPESAS CORRENTES,DIÁRIAS FORA DO ESTADO DE PERNAMBUCO E NO BRASIL, 138.150.28 
2016,OUTRAS DESPESAS CORRENTES,DIÁRIAS NO ESTADO DE PERNAMBUCO, 10.464.98 
2016,OUTRAS DESPESAS CORRENTES,DIÁRIAS NO EXTERIOR, 117.081.77 
2016,OUTRAS DESPESAS CORRENTES,ENCARGOS GERAIS AOS DIVERSOS ÓRGÃOS, 800.10 
2016,OUTRAS DESPESAS CORRENTES,ESTAGIÁRIOS, 251.411.43 
2016,OUTRAS DESPESAS CORRENTES,ESTAGIÁRIOS PETI, 3.918.47 
2016,OUTRAS DESPESAS CORRENTES,EXPOSIÇÕES, CONGRESSOS E CONFERÊNCIAS, 1.559.797.05 
2016,OUTRAS DESPESAS CORRENTES,FERRAMENTAS, 181.026.18 
2016,OUTRAS DESPESAS CORRENTES,FESTIVIDADES E HOMENAGENS, 206.082.37 
2016,OUTRAS DESPESAS CORRENTES,FORNECIMENTO DE ALIMENTAÇÃO, 9.274.070.10 
2016,OUTRAS DESPESAS CORRENTES,FORNECIMENTO DE CESTAS BÁSICAS PARA FAMÍLIAS CARENTES, 168.965.10 
2016,OUTRAS DESPESAS CORRENTES,FORNECIMENTO DE PEÇAS DE REPOSIÇÃO - USO IMEDIATO, 350.00 
2016,OUTRAS DESPESAS CORRENTES,FRETES E TRANSPORTES DE ENCOMENDAS, 1.781.589.53 
2016,OUTRAS DESPESAS CORRENTES,GÁS ENGARRAFADO, 66.137.01 
2016,OUTRAS DESPESAS CORRENTES,GASES MEDICINAIS, 1.283.902.28 
2016,OUTRAS DESPESAS CORRENTES,GÊNEROS ALIMENTÍCIOS, 4.593.379.64 
2016,OUTRAS DESPESAS CORRENTES,GERENCIAMENTO DE FROTA DE VEÍCULOS - COMBUSTÍVEIS E LUBRIFICANTES, 7.826.283.65 
2016,OUTRAS DESPESAS CORRENTES,HOSPEDAGENS, 305.962.00 
2016,OUTRAS DESPESAS CORRENTES,IDENIZAÇÕES E RESTITUIÇÕES, 660.827.10 
2016,OUTRAS DESPESAS CORRENTES,IMPOSTO DE RENDA, 42.469.14 
2016,OUTRAS DESPESAS CORRENTES,IMPOSTO SOBRE OPERAÇÕES FINANCEIRAS - IOF, 3.396.57 
2016,OUTRAS DESPESAS CORRENTES,IMPOSTO SOBRE PROPRIEDADE DE VEÍCULOS AUTOMOTORES - IPVA, 15.376.49 
2016,OUTRAS DESPESAS CORRENTES,IMPOSTO SOBRE PROPRIEDADE PREDIAL E TERRITORIAL URBANA - IPTU, 166.747.91 
2016,OUTRAS DESPESAS CORRENTES,IMPOSTO SOBRE SERVIÇOS DE QUALQUER NATUREZA - ISS, 140.615.10 
2016,OUTRAS DESPESAS CORRENTES,INDENIZAÇÕES, 1.284.497.40 
2016,OUTRAS DESPESAS CORRENTES,INDENIZAÇÕES E RESTITUIÇÕES, 4.122.124.39 
2016,OUTRAS DESPESAS CORRENTES,INDENIZAÇÕES E RESTITUIÇÕES À UNIÃO, 339.945.60 
2016,OUTRAS DESPESAS CORRENTES,JETONS A CONSELHEIROS, 340.642.92 
2016,OUTRAS DESPESAS CORRENTES,JUROS, 350.537.91 
2016,OUTRAS DESPESAS CORRENTES,LIMPEZA E CONSERVAÇÃO, 73.491.769.82 
2016,OUTRAS DESPESAS CORRENTES,LOCAÇÃO DE BENS MÓVEIS DE OUTRAS NATUREZAS, 3.318.628.61 
2016,OUTRAS DESPESAS CORRENTES,LOCAÇÃO DE CILINDROS DE GASES MEDICINAIS, 36.578.50 
2016,OUTRAS DESPESAS CORRENTES,LOCAÇÃO DE IMÓVEIS, 11.382.509.26 
2016,OUTRAS DESPESAS CORRENTES,LOCAÇÃO DE MÁQUINAS E EQUIPAMENTOS, 8.104.355.66 
2016,OUTRAS DESPESAS CORRENTES,LOCAÇÃO DE MÃO-DE-OBRA, 13.778.256.98 
2016,OUTRAS DESPESAS CORRENTES,LOCAÇÃO DE SOFTWARES, 1.347.496.66 
2016,OUTRAS DESPESAS CORRENTES,LOCAÇÃO DE VEÍCULOS, 17.075.869.81 
2016,OUTRAS DESPESAS CORRENTES,MÁQUINAS, INSTALAÇÕES E UTENSÍLIOS DE ESCRITÓRIO, 4.164.10 
2016,OUTRAS DESPESAS CORRENTES,MANUTENÇÃO E CONSERVAÇÃO DE AVENIDAS, RUAS, PRAÇAS E VIAS, 17.278.105.77 
2016,OUTRAS DESPESAS CORRENTES,MANUTENÇÃO E CONSERVAÇÃO DE BENS IMÓVEIS, 39.082.686.99 
2016,OUTRAS DESPESAS CORRENTES,MANUTENÇÃO E CONSERVAÇÃO DE BENS MÓVEIS, 44.636.37 
2016,OUTRAS DESPESAS CORRENTES,MANUTENÇÃO E CONSERVAÇÃO DE BENS MÓVEIS DE OUTRAS NATUREZAS, 426.366.78 
2016,OUTRAS DESPESAS CORRENTES,MANUTENÇÃO E CONSERVAÇÃO DE EQUIPAMENTOS, 7.275.00 
2016,OUTRAS DESPESAS CORRENTES,MANUTENÇÃO E CONSERVAÇÃO DE EQUIPAMENTOS DE PROCESSAMENTO DE DADOS, 506.290.52 
2016,OUTRAS DESPESAS CORRENTES,MANUTENÇÃO E CONSERVAÇÃO DE MÁQUINAS E EQUIPAMENTOS, 6.761.886.77 
2016,OUTRAS DESPESAS CORRENTES,MANUTENÇÃO E CONSERVAÇÃO DE VEÍCULOS, 131.618.44 
2016,OUTRAS DESPESAS CORRENTES,MANUTENÇÃO E CONSERVAÇÃO DO SIST  ILUMINAÇÃO PÚBLICA, 9.594.099.96 
2016,OUTRAS DESPESAS CORRENTES,MATERIAIS PARA CONSTRUÇÃO EM GERAL, 110.045.45 
2016,OUTRAS DESPESAS CORRENTES,MATERIAL BIBLIOGRÁFICO NÃO IMOBILIZÁVEL, 72.247.58 
2016,OUTRAS DESPESAS CORRENTES,MATERIAL CULTURAL, ARTESANATOS E AFINS, 51.164.90 
2016,OUTRAS DESPESAS CORRENTES,MATERIAL DE ACONDICIONAMENTO E EMBALAGEM, 319.191.19 
2016,OUTRAS DESPESAS CORRENTES,MATERIAL DE CAMA, MESA E BANHO, 491.377.40 
2016,OUTRAS DESPESAS CORRENTES,MATERIAL DE CONSUMO, 8.635.068.53 
2016,OUTRAS DESPESAS CORRENTES,MATERIAL DE CONSUMO DE INFORMÁTICA, 242.283.93 
2016,OUTRAS DESPESAS CORRENTES,MATERIAL DE COPA E COZINHA, 783.601.35 
2016,OUTRAS DESPESAS CORRENTES,MATERIAL DE DISTRIBUIÇÃO GRATUITA, 3.528.902.57 
2016,OUTRAS DESPESAS CORRENTES,MATERIAL DE EXPEDIENTE, 1.117.789.28 
2016,OUTRAS DESPESAS CORRENTES,MATERIAL DE LIMPEZA E DE HIGIENE PESSOAL, 5.921.70 
2016,OUTRAS DESPESAS CORRENTES,MATERIAL DE LIMPEZA E PRODUTOS DE HIGIENIZAÇÃO - ARTIGOS PARA HIGIENE PESSOAL, 859.008.71 
2016,OUTRAS DESPESAS CORRENTES,MATERIAL DE LIMPEZA E PRODUTOS DE HIGIENIZAÇÃO - MATERIAIS E UTENSÍLIOS DE LIMPEZA, 2.605.205.56 
2016,OUTRAS DESPESAS CORRENTES,MATERIAL DE MANOBRA E PATRULHAMENTO, 4.100.00 
2016,OUTRAS DESPESAS CORRENTES,MATERIAL DE PROCESSAMENTO DE DADOS, 57.895.32 
2016,OUTRAS DESPESAS CORRENTES,MATERIAL DE PROTEÇÃO E SEGURANÇA, 3.503.966.15 
2016,OUTRAS DESPESAS CORRENTES,MATERIAL DE SINALIZAÇÃO VISUAL E AFINS, 600.972.30 
2016,OUTRAS DESPESAS CORRENTES,MATERIAL DE TRÂNSITO, 520.00 
2016,OUTRAS DESPESAS CORRENTES,MATERIAL DESTINADO A ASSISTÊNCIA SOCIAL, 222.473.50 
2016,OUTRAS DESPESAS CORRENTES,MATERIAL DIDÁTICO E TÉCNICO PARA DISTRIBUIÇÃO, 22.347.924.97 
2016,OUTRAS DESPESAS CORRENTES,MATERIAL E MEDICAMENTO VETERINÁRIO, 34.503.50 
2016,OUTRAS DESPESAS CORRENTES,MATERIAL EDUCACIONAL E DIVULGAÇÃO, 19.267.056.48 
2016,OUTRAS DESPESAS CORRENTES,MATERIAL EDUCATIVO E ESPORTIVO, 748.051.88 
2016,OUTRAS DESPESAS CORRENTES,MATERIAL ELÉTRICO E ELETRÔNICO, 6.605.790.22 
2016,OUTRAS DESPESAS CORRENTES,MATERIAL FARMACOLÓGICO, 5.343.253.79 
2016,OUTRAS DESPESAS CORRENTES,MATERIAL HOSPITALAR, 7.478.879.29 
2016,OUTRAS DESPESAS CORRENTES,MATERIAL LABORATORIAL, 3.569.042.91 
2016,OUTRAS DESPESAS CORRENTES,MATERIAL ODONTOLÓGICO, 606.778.23 
2016,OUTRAS DESPESAS CORRENTES,MATERIAL PARA ÁUDIO, VÍDEO E FOTO, 67.563.35 
2016,OUTRAS DESPESAS CORRENTES,MATERIAL PARA COMUNICAÇÕES, 22.273.28 
2016,OUTRAS DESPESAS CORRENTES,MATERIAL PARA FESTIVIDADES E HOMENAGENS, 28.632.00 
2016,OUTRAS DESPESAS CORRENTES,MATERIAL PARA MANUTENÇÃO DE BENS IMÓVEIS, 1.222.629.87 
2016,OUTRAS DESPESAS CORRENTES,MATERIAL PARA MANUTENÇÃO DE BENS MÓVEIS, 93.851.85 
2016,OUTRAS DESPESAS CORRENTES,MATERIAL PARA MANUTENÇÃO DE VEÍCULOS, 1.599.374.45 
2016,OUTRAS DESPESAS CORRENTES,MATERIAL PARA REABILITAÇÃO, 146.812.64 
2016,OUTRAS DESPESAS CORRENTES,MATERIAL PARA UTILIZAÇÃO EM GRÁFICA, 15.324.20 
2016,OUTRAS DESPESAS CORRENTES,MATERIAL QUÍMICO, 1.546.884.75 
2016,OUTRAS DESPESAS CORRENTES,MEDALHAS E TROFÉUS, 109.865.20 
2016,OUTRAS DESPESAS CORRENTES,MEDICAMENTOS, 11.875.879.87 
2016,OUTRAS DESPESAS CORRENTES,MERENDA - GÊNEROS DE ALIMENTAÇÃO, 49.822.769.80 
2016,OUTRAS DESPESAS CORRENTES,MERENDA COM RECURSOS FNDE - CONVÊNIO SECRETARIA DE EDUCAÇÃO, 7.993.700.59 
2016,OUTRAS DESPESAS CORRENTES,MERENDA ESCOLAR, 9.712.404.54 
2016,OUTRAS DESPESAS CORRENTES,MULTAS, 655.072.63 
2016,OUTRAS DESPESAS CORRENTES,OBRIGAÇÕES PATRONAIS SOBRE SERVIÇO DE PESSOA JURÍDICA, 32.121.46 
2016,OUTRAS DESPESAS CORRENTES,OBRIGAÇÕES TRIBUTÁRIAS E CONTRIBUTIVAS, 47.506.36 
2016,OUTRAS DESPESAS CORRENTES,ORGANIZAÇÃO, INFORMATIZAÇÃO, GUARDA, GERENCIAMENTO E DIGITALIZAÇÃO DE DOCUMENTOS, 283.320.39 
2016,OUTRAS DESPESAS CORRENTES,OUTROS BENEFÍCIOS ASSISTENCIAIS, 17.600.00 
2016,OUTRAS DESPESAS CORRENTES,OUTROS SERVIÇOS DE ENGENHARIA, 275.681.41 
2016,OUTRAS DESPESAS CORRENTES,OUTROS SERVIÇOS DE TERCEIROS - PESSOA FÍSICA, 17.256.880.80 
2016,OUTRAS DESPESAS CORRENTES,OUTROS SERVIÇOS DE TERCEIROS - PESSOA JURÍDICA, 7.812.000.00 
2016,OUTRAS DESPESAS CORRENTES,PAGAMENTO DE INSS - PESSOA FÍSICA, 20.976.39 
2016,OUTRAS DESPESAS CORRENTES,PASSAGENS AÉREAS NO ÂMBITO INTERNACIONAL E DEMAIS SERVIÇOS CORRELATOS, -   
2016,OUTRAS DESPESAS CORRENTES,PASSAGENS E DESPESAS COM LOCOMOÇÃO, 814.480.28 
2016,OUTRAS DESPESAS CORRENTES,PASSAGENS PARA O EXTERIOR, 114.740.65 
2016,OUTRAS DESPESAS CORRENTES,PASSAGENS PARA O PAÍS, 1.227.123.56 
2016,OUTRAS DESPESAS CORRENTES,PASSE LIVRE PARA ALUNOS DA REDE FUNDAMENTAL DE ENSINO, 2.343.717.36 
2016,OUTRAS DESPESAS CORRENTES,PRÊMIOS E CONDECORAÇÕES, 224.500.00 
2016,OUTRAS DESPESAS CORRENTES,PRÊMIOS EM PECÚNIA, 430.560.00 
2016,OUTRAS DESPESAS CORRENTES,PUBLICIDADE E PROPAGANDA, 3.364.364.82 
2016,OUTRAS DESPESAS CORRENTES,RECAPEAMENTO ASFÁLTICO, 9.296.403.46 
2016,OUTRAS DESPESAS CORRENTES,RECICLAGEM DE CARTUCHOS PARA IMPRESSORAS, 60.709.17 
2016,OUTRAS DESPESAS CORRENTES,RESTITUIÇÕES, 2.405.297.83 
2016,OUTRAS DESPESAS CORRENTES,SEGURO DE VIDA PARA O SERVIDOR, 1.500.00 
2016,OUTRAS DESPESAS CORRENTES,SEGUROS EM GERAL, 549.211.10 
2016,OUTRAS DESPESAS CORRENTES,SEMENTES, MUDAS DE PLANTAS E INSUMOS, 24.368.50 
2016,OUTRAS DESPESAS CORRENTES,SENTENÇAS INDENIZATÓRIAS, 5.475.829.56 
2016,OUTRAS DESPESAS CORRENTES,SENTENÇAS PARA CRÉDITOS ALIMENTÍCIOS, 5.978.621.22 
2016,OUTRAS DESPESAS CORRENTES,SERVIÇO DE CONECTIVIDADE E INTERNET, 2.383.551.99 
2016,OUTRAS DESPESAS CORRENTES,SERVIÇO DE MONITORAMENTO DE RÁDIO E TV, REDES SOCIAIS, MÍDIA IMPRESSA E PLATAFORMA DIGITAL, 888.005.70 
2016,OUTRAS DESPESAS CORRENTES,SERVIÇOS BANCÁRIOS, 2.162.703.55 
2016,OUTRAS DESPESAS CORRENTES,SERVIÇOS COM FUNERAL INCLUINDO ATAÚDE, TRASLADO, FLORES, TAXAS E REGISTRO EM CARTÓRIO, 900.00 
2016,OUTRAS DESPESAS CORRENTES,SERVIÇOS CONVENIADOS COM ESTADO DE PE PARA IMPLEMENTAÇÃO DE SISTEMA DE VIDEOMONITORAMENTO, 2.974.601.47 
2016,OUTRAS DESPESAS CORRENTES,SERVIÇOS CONVENIADOS PARA RESSOCIALIZAÇÃO DE APENADOS, 2.221.140.00 
2016,OUTRAS DESPESAS CORRENTES,SERVIÇOS CONVENIADOS PELA UFPE, -   
2016,OUTRAS DESPESAS CORRENTES,SERVIÇOS CULTURAIS, TURÍSTICOS, ESPORTIVOS E DE LAZER, 36.277.861.20 
2016,OUTRAS DESPESAS CORRENTES,SERVIÇOS CULTURAIS, TURISTICOS, ESPORTIVOS E DE LAZER, 235.791.00 
2016,OUTRAS DESPESAS CORRENTES,SERVIÇOS DE ÁGUA E ESGOTO, 10.199.928.73 
2016,OUTRAS DESPESAS CORRENTES,SERVIÇOS DE ÁUDIO, VÍDEO E FOTO, 656.616.04 
2016,OUTRAS DESPESAS CORRENTES,SERVIÇOS DE APOIO A VIGILÂNCIA AMBIENTAL, 542.581.96 
2016,OUTRAS DESPESAS CORRENTES,SERVIÇOS DE APOIO ADMINISTRATIVO, TÉCNICO E OPERACIONAL, 467.616.12 
2016,OUTRAS DESPESAS CORRENTES,SERVIÇOS DE APOIO AO ENSINO, 921.008.04 
2016,OUTRAS DESPESAS CORRENTES,SERVIÇOS DE APOIO SOCIAL E HOSPITALAR, 1.738.704.96 
2016,OUTRAS DESPESAS CORRENTES,SERVIÇOS DE ASSISTÊNCIA SOCIAL, 681.830.00 
2016,OUTRAS DESPESAS CORRENTES,SERVIÇOS DE CÓPIAS E REPRODUÇÃO DE DOCUMENTOS, 908.770.40 
2016,OUTRAS DESPESAS CORRENTES,SERVIÇOS DE COMUNICAÇÃO EM GERAL, 2.479.974.33 
2016,OUTRAS DESPESAS CORRENTES,SERVIÇOS DE CONDUTORES DE VEÍCULOS, 27.601.644.02 
2016,OUTRAS DESPESAS CORRENTES,SERVIÇOS DE CONFECÇÃO DE BENS MÓVEIS DE QUALQUER NATUREZA, 495.009.44 
2016,OUTRAS DESPESAS CORRENTES,SERVIÇOS DE CONSULTORIA, 192.065.32 
2016,OUTRAS DESPESAS CORRENTES,SERVIÇOS DE COPA E COZINHA, 435.423.54 
2016,OUTRAS DESPESAS CORRENTES,SERVIÇOS DE DIGITADORES, 10.306.269.65 
2016,OUTRAS DESPESAS CORRENTES,SERVIÇOS DE ENERGIA ELÉTRICA DE USO COMERCIAL OU RESIDENCIAL, 116.004.74 
2016,OUTRAS DESPESAS CORRENTES,SERVIÇOS DE ENERGIA ELÉTRICA DE VIAS PÚBLICAS, 23.502.625.29 
2016,OUTRAS DESPESAS CORRENTES,SERVIÇOS DE ENERGIA ELÉTRICA USO COMERCIAL OU RESIDENCIAL, 24.751.911.30 
2016,OUTRAS DESPESAS CORRENTES,SERVIÇOS DE ESTAGIÁRIOS, 16.684.550.06 
2016,OUTRAS DESPESAS CORRENTES,SERVIÇOS DE INFORMÁTICA, 15.708.66 
2016,OUTRAS DESPESAS CORRENTES,SERVIÇOS DE LIMPEZA E CONSERVAÇÃO, 16.193.25 
2016,OUTRAS DESPESAS CORRENTES,SERVIÇOS DE LIMPEZA URBANA, 223.053.161.62 
2016,OUTRAS DESPESAS CORRENTES,SERVIÇOS DE LOGÍSTICA, DISTRIBUIÇÃO E GESTÃO DE TRANSPORTE DE CARGAS, 5.968.489.40 
2016,OUTRAS DESPESAS CORRENTES,SERVIÇOS DE MONITORAMENTO EM GERAL, 175.145.54 
2016,OUTRAS DESPESAS CORRENTES,SERVIÇOS DE PATROCÍNIOS EM GERAL, 350.000.00 
2016,OUTRAS DESPESAS CORRENTES,SERVIÇOS DE POSTAGEM, 3.185.28 
2016,OUTRAS DESPESAS CORRENTES,SERVIÇOS DE PROCESSAMENTO DE DADOS, 17.257.574.93 
2016,OUTRAS DESPESAS CORRENTES,SERVIÇOS DE PUBLICIDADE E PROPAGANDA, 27.666.176.42 
2016,OUTRAS DESPESAS CORRENTES,SERVIÇOS DE RECEPCIONISTAS, 7.885.263.49 
2016,OUTRAS DESPESAS CORRENTES,SERVIÇOS DE REMOÇÃO, 715.898.65 
2016,OUTRAS DESPESAS CORRENTES,SERVIÇOS DE SELEÇÃO E TREINAMENTO, 2.528.171.01 
2016,OUTRAS DESPESAS CORRENTES,SERVIÇOS DE SISTEMA DE TELECOMUNICAÇÃO VIA RÁDIO ENTRE SERVIDORES, 1.251.336.87 
2016,OUTRAS DESPESAS CORRENTES,SERVIÇOS DE TELEFONIA - TRANSMISSÃO DE DADOS, 352.136.48 
2016,OUTRAS DESPESAS CORRENTES,SERVIÇOS DE TELEFONIA FIXA, 6.559.181.85 
2016,OUTRAS DESPESAS CORRENTES,SERVIÇOS DE TELEFONIA MÓVEL CELULAR, 414.537.23 
2016,OUTRAS DESPESAS CORRENTES,SERVIÇOS DE TERCEIROS - PESSOA JURÍDICA, 35.981.822.59 
2016,OUTRAS DESPESAS CORRENTES,SERVIÇOS DE TRÂNSITO E SINALIZAÇÃO, 13.146.467.71 
2016,OUTRAS DESPESAS CORRENTES,SERVIÇOS DE TRANSPORTES DE PESSOAS, 511.180.07 
2016,OUTRAS DESPESAS CORRENTES,SERVIÇOS DOMÉSTICOS, 3.150.00 
2016,OUTRAS DESPESAS CORRENTES,SERVIÇOS GRÁFICOS, CONFECÇÃO DE CARIMBOS E PLAQUETAS EM GERAL, 2.844.070.32 
2016,OUTRAS DESPESAS CORRENTES,SERVIÇOS JUDICIÁRIOS, 45.046.48 
2016,OUTRAS DESPESAS CORRENTES,SERVIÇOS MÉDICO-HOSPITALARES, ODONTOLÓGICOS E LABORATORIAIS, 65.219.127.73 
2016,OUTRAS DESPESAS CORRENTES,SERVIÇOS MÉDICOS E ODONTOLÓGICOS, 1.082.661.14 
2016,OUTRAS DESPESAS CORRENTES,SERVIÇOS SE SECRETÁRIOS(AS) BILING, 55.150.92 
2016,OUTRAS DESPESAS CORRENTES,SERVIÇOS TÉCNICOS PROFISSIONAIS, 18.286.410.22 
2016,OUTRAS DESPESAS CORRENTES,SERVIÇOS TERCEIRIZADOS EM HOSPITAIS, MATERNIDADES E POSTOS DE SAÚDE, 146.242.26 
2016,OUTRAS DESPESAS CORRENTES,SERVIÇOS VETERINÁRIOS EM GERAL, 3.136.42 
2016,OUTRAS DESPESAS CORRENTES,SOBRESSALENTES, MÁQUINAS E MOTORES DE NAVIOS E EM-BARCAÇÕES, 7.995.40 
2016,OUTRAS DESPESAS CORRENTES,SUBVENÇÕES SOCIAIS A INSTITUIÇÕES PRIVADAS SEM FINS LUCRATIVOS, 144.209.582.04 
2016,OUTRAS DESPESAS CORRENTES,SUPRIMENTO INDIVIDUAL, 3.765.533.90 
2016,OUTRAS DESPESAS CORRENTES,TAXAS, 360.612.15 
2016,OUTRAS DESPESAS CORRENTES,UNIFORMES, TECIDOS E AVIAMENTOS, 1.801.017.36 
2016,OUTRAS DESPESAS CORRENTES,VALE TRANSPORTE, 1.590.403.60 
2016,OUTRAS DESPESAS CORRENTES,VALE TRANSPORTE PARA ESTAGIÁRIOS, 211.041.08 
2016,OUTRAS DESPESAS CORRENTES,VALE TRANSPORTE PARA PROJETOS SOCIAIS, 208.615.70 
2016,OUTRAS DESPESAS CORRENTES,VALE-ALIMENTAÇÃO, 10.180.802.25 
2016,OUTRAS DESPESAS CORRENTES,VALE-TRANSPORTE, 22.490.213.53 
2016,OUTRAS DESPESAS CORRENTES,VALE-TRANSPORTE PARA SERVIDORES, 430.630.78 
2016,OUTRAS DESPESAS CORRENTES,VIGILÂNCIA OSTENSIVA, 25.923.343.53 
2016,PESSOAL E ENCARGOS SOCIAIS.13º SALÁRIO, 124.859.313.94 
2016,PESSOAL E ENCARGOS SOCIAIS.13º SALÁRIO - RGPS, 722.621.94 
2016,PESSOAL E ENCARGOS SOCIAIS,ADICIONAL DE PERICULOSIDADE, INSALUBRIDADE E ATIV  PENOSAS - RGPS, 58.774.18 
2016,PESSOAL E ENCARGOS SOCIAIS,ADICIONAL DE PERICULOSIDADE, INSALUBRIDADE E ATIVIDADES PENOSAS, 26.064.264.32 
2016,PESSOAL E ENCARGOS SOCIAIS,ADICIONAL NOTURNO, 6.050.706.39 
2016,PESSOAL E ENCARGOS SOCIAIS,ADICIONAL NOTURNO - RGPS, 8.296.75 
2016,PESSOAL E ENCARGOS SOCIAIS,AJUDA DE CUSTO, 6.740.645.70 
2016,PESSOAL E ENCARGOS SOCIAIS,APOSENTADORIAS E REFORMAS - RPPS, 6.663.299.52 
2016,PESSOAL E ENCARGOS SOCIAIS,CONTRIBUIÇÕES PREVIDENCIÁRIAS - INSS, 79.286.364.16 
2016,PESSOAL E ENCARGOS SOCIAIS,CONTRIBUIÇÃO PARA SALÁRIO-EDUCAÇÃO, 1.866.967.01 
